{
  "entityType": "npc",
  "name": "NPC Ship",
  "description": "AI-controlled spacecraft",
  "variants": {
    "trader": {
      "name": "Trader Ship",
      "shipClass": "freighter",
      "faction": "Traders Guild",
      "hostileToPlayer": false,
      "cargoCapacity": 200.0,
      "ai": {
        "behaviorType": "trader",
        "patrolRoute": true,
        "fleeOnDamage": true,
        "aggroRange": 0.0
      },
      "rendering": {
        "color": { "r": 0.3, "g": 0.7, "b": 0.3 },
        "scale": 0.8
      }
    },
    "pirate": {
      "name": "Pirate Ship",
      "shipClass": "fighter",
      "faction": "Pirates",
      "hostileToPlayer": true,
      "cargoCapacity": 50.0,
      "ai": {
        "behaviorType": "aggressive",
        "patrolRoute": true,
        "pursuitRange": 500.0,
        "aggroRange": 200.0
      },
      "rendering": {
        "color": { "r": 0.9, "g": 0.2, "b": 0.2 },
        "scale": 0.7
      }
    },
    "patrol": {
      "name": "Patrol Ship",
      "shipClass": "fighter",
      "faction": "Security Forces",
      "hostileToPlayer": false,
      "cargoCapacity": 30.0,
      "ai": {
        "behaviorType": "patrol",
        "patrolRoute": true,
        "respondToDistress": true,
        "aggroRange": 150.0
      },
      "rendering": {
        "color": { "r": 0.2, "g": 0.5, "b": 0.9 },
        "scale": 0.7
      }
    }
  },
  "defaults": {
    "physics": {
      "mass": 5000.0,
      "drag": 0.15,
      "gravityEnabled": false
    },
    "vitals": {
      "maxHealth": 100.0,
      "health": 100.0,
      "maxShields": 50.0,
      "shields": 50.0,
      "shieldRegenRate": 2.0
    },
    "rendering": {
      "renderMode": "Mesh3D",
      "meshPath": "assets/models/npc_ship.obj"
    },
    "weapons": {
      "primaryWeapon": "laser_cannon",
      "fireRate": 2.0,
      "damage": 10.0,
      "range": 300.0
    }
  }
}
